{
  "effective_date": "2026-10-24",
  "valid_from": "2026-10-24",
  "valid_to": "2026-10-30",
  "source_file": "e71c5029-image.jpg (chicken, eggs) + 62c90b4e-image.jpg (pork) — sheet 24/10/2026-30/10/2026, replaces the carry-over",
  "extracted_by": "claude",
  "currency": "THB",
  "prices": [
    {
      "sku": "PK-001",
      "qty_unit": "kg",
      "tiers": [
        {
          "min_qty": 1,
          "max_qty": 2,
          "price": 87
        },
        {
          "min_qty": 3,
          "max_qty": 5,
          "price": 80
        },
        {
          "min_qty": 6,
          "price": 75
        }
      ]
    },
    {
      "sku": "PK-002",
      "qty_unit": "kg",
      "tiers": [
        {
          "min_qty": 1,
          "max_qty": 2,
          "price": 64
        },
        {
          "min_qty": 3,
          "max_qty": 5,
          "price": 60
        },
        {
          "min_qty": 6,
          "price": 57
        }
      ]
    },
    {
      "sku": "PK-003",
      "qty_unit": "kg",
      "tiers": [
        {
          "min_qty": 1,
          "max_qty": 2,
          "price": 64
        },
        {
          "min_qty": 3,
          "max_qty": 5,
          "price": 60
        },
        {
          "min_qty": 6,
          "price": 57
        }
      ]
    },
    {
      "sku": "PK-004",
      "qty_unit": "kg",
      "tiers": [
        {
          "min_qty": 1,
          "max_qty": 2,
          "price": 157
        },
        {
          "min_qty": 3,
          "max_qty": 5,
          "price": 150
        },
        {
          "min_qty": 6,
          "price": 145
        }
      ]
    },
    {
      "sku": "PK-005",
      "qty_unit": "kg",
      "tiers": [
        {
          "min_qty": 1,
          "max_qty": 2,
          "price": 357
        },
        {
          "min_qty": 3,
          "max_qty": 5,
          "price": 348
        },
        {
          "min_qty": 6,
          "price": 340
        }
      ]
    },
    {
      "sku": "PK-006",
      "qty_unit": "kg",
      "tiers": [
        {
          "min_qty": 1,
          "max_qty": 2,
          "price": 143
        },
        {
          "min_qty": 3,
          "max_qty": 5,
          "price": 138
        },
        {
          "min_qty": 6,
          "price": 133
        }
      ]
    },
    {
      "sku": "PK-007",
      "qty_unit": "kg",
      "tiers": [
        {
          "min_qty": 1,
          "max_qty": 2,
          "price": 161
        },
        {
          "min_qty": 3,
          "max_qty": 5,
          "price": 149
        },
        {
          "min_qty": 6,
          "price": 144
        }
      ]
    },
    {
      "sku": "PK-008",
      "qty_unit": "kg",
      "tiers": [
        {
          "min_qty": 1,
          "max_qty": 2,
          "price": 151
        },
        {
          "min_qty": 3,
          "max_qty": 5,
          "price": 144
        },
        {
          "min_qty": 6,
          "price": 139
        }
      ]
    },
    {
      "sku": "PK-009",
      "qty_unit": "kg",
      "tiers": [
        {
          "min_qty": 1,
          "max_qty": 2,
          "price": 126
        },
        {
          "min_qty": 3,
          "max_qty": 5,
          "price": 119
        },
        {
          "min_qty": 6,
          "price": 117
        }
      ]
    },
    {
      "sku": "PK-010",
      "qty_unit": "kg",
      "tiers": [
        {
          "min_qty": 1,
          "max_qty": 2,
          "price": 124
        },
        {
          "min_qty": 3,
          "max_qty": 5,
          "price": 117
        },
        {
          "min_qty": 6,
          "price": 115
        }
      ]
    },
    {
      "sku": "PK-011",
      "qty_unit": "kg",
      "tiers": [
        {
          "min_qty": 1,
          "max_qty": 2,
          "price": 189
        },
        {
          "min_qty": 3,
          "max_qty": 5,
          "price": 182
        },
        {
          "min_qty": 6,
          "price": 177
        }
      ]
    },
    {
      "sku": "PK-012",
      "qty_unit": "kg",
      "tiers": [
        {
          "min_qty": 1,
          "max_qty": 2,
          "price": 202
        },
        {
          "min_qty": 3,
          "max_qty": 5,
          "price": 195
        },
        {
          "min_qty": 6,
          "price": 190
        }
      ]
    },
    {
      "sku": "PK-013",
      "qty_unit": "kg",
      "tiers": [
        {
          "min_qty": 1,
          "max_qty": 2,
          "price": 162
        },
        {
          "min_qty": 3,
          "max_qty": 5,
          "price": 155
        },
        {
          "min_qty": 6,
          "price": 150
        }
      ]
    },
    {
      "sku": "PK-014",
      "qty_unit": "kg",
      "tiers": [
        {
          "min_qty": 1,
          "max_qty": 2,
          "price": 141
        },
        {
          "min_qty": 3,
          "max_qty": 5,
          "price": 134
        },
        {
          "min_qty": 6,
          "price": 129
        }
      ]
    },
    {
      "sku": "PK-015",
      "qty_unit": "kg",
      "tiers": [
        {
          "min_qty": 1,
          "max_qty": 2,
          "price": 144
        },
        {
          "min_qty": 3,
          "max_qty": 5,
          "price": 137
        },
        {
          "min_qty": 6,
          "price": 132
        }
      ]
    },
    {
      "sku": "PK-016",
      "qty_unit": "kg",
      "tiers": [
        {
          "min_qty": 1,
          "max_qty": 2,
          "price": 178
        },
        {
          "min_qty": 3,
          "max_qty": 5,
          "price": 174
        },
        {
          "min_qty": 6,
          "price": 169
        }
      ]
    },
    {
      "sku": "PK-017",
      "qty_unit": "kg",
      "tiers": [
        {
          "min_qty": 1,
          "max_qty": 2,
          "price": 205
        },
        {
          "min_qty": 3,
          "max_qty": 5,
          "price": 197
        },
        {
          "min_qty": 6,
          "price": 191
        }
      ]
    },
    {
      "sku": "PK-018",
      "qty_unit": "kg",
      "tiers": [
        {
          "min_qty": 1,
          "max_qty": 2,
          "price": 166
        },
        {
          "min_qty": 3,
          "max_qty": 5,
          "price": 159
        },
        {
          "min_qty": 6,
          "price": 157
        }
      ]
    },
    {
      "sku": "PK-019",
      "qty_unit": "kg",
      "tiers": [
        {
          "min_qty": 1,
          "max_qty": 2,
          "price": 202
        },
        {
          "min_qty": 3,
          "max_qty": 5,
          "price": 197
        },
        {
          "min_qty": 6,
          "price": 193
        }
      ]
    },
    {
      "sku": "PK-020",
      "qty_unit": "kg",
      "tiers": [
        {
          "min_qty": 1,
          "max_qty": 2,
          "price": 227
        },
        {
          "min_qty": 3,
          "max_qty": 5,
          "price": 220
        },
        {
          "min_qty": 6,
          "price": 215
        }
      ]
    },
    {
      "sku": "PK-021",
      "qty_unit": "kg",
      "tiers": [
        {
          "min_qty": 1,
          "max_qty": 2,
          "price": 135
        },
        {
          "min_qty": 3,
          "price": 130
        }
      ]
    },
    {
      "sku": "PK-022",
      "qty_unit": "kg",
      "tiers": [
        {
          "min_qty": 1,
          "max_qty": 2,
          "price": 127
        },
        {
          "min_qty": 3,
          "max_qty": 5,
          "price": 120
        },
        {
          "min_qty": 6,
          "price": 115
        }
      ]
    },
    {
      "sku": "PK-023",
      "qty_unit": "kg",
      "tiers": [
        {
          "min_qty": 1,
          "max_qty": 2,
          "price": 107
        },
        {
          "min_qty": 3,
          "max_qty": 5,
          "price": 100
        },
        {
          "min_qty": 6,
          "price": 93
        }
      ]
    },
    {
      "sku": "PK-024",
      "qty_unit": "kg",
      "tiers": [
        {
          "min_qty": 1,
          "max_qty": 2,
          "price": 29
        },
        {
          "min_qty": 3,
          "max_qty": 5,
          "price": 22
        },
        {
          "min_qty": 6,
          "price": 19
        }
      ]
    },
    {
      "sku": "PK-025",
      "qty_unit": "kg",
      "tiers": [
        {
          "min_qty": 1,
          "max_qty": 2,
          "price": 37
        },
        {
          "min_qty": 3,
          "max_qty": 5,
          "price": 30
        },
        {
          "min_qty": 6,
          "price": 25
        }
      ]
    },
    {
      "sku": "PK-026",
      "qty_unit": "kg",
      "tiers": [
        {
          "min_qty": 1,
          "max_qty": 2,
          "price": 160
        },
        {
          "min_qty": 3,
          "max_qty": 5,
          "price": 153
        },
        {
          "min_qty": 6,
          "price": 148
        }
      ]
    },
    {
      "sku": "PK-027",
      "qty_unit": "kg",
      "tiers": [
        {
          "min_qty": 1,
          "max_qty": 2,
          "price": 87
        },
        {
          "min_qty": 3,
          "max_qty": 5,
          "price": 80
        },
        {
          "min_qty": 6,
          "price": 75
        }
      ]
    },
    {
      "sku": "PK-028",
      "qty_unit": "kg",
      "tiers": [
        {
          "min_qty": 1,
          "max_qty": 2,
          "price": 92
        },
        {
          "min_qty": 3,
          "max_qty": 5,
          "price": 85
        },
        {
          "min_qty": 6,
          "price": 80
        }
      ]
    },
    {
      "sku": "PK-029",
      "qty_unit": "kg",
      "tiers": [
        {
          "min_qty": 1,
          "max_qty": 2,
          "price": 72
        },
        {
          "min_qty": 3,
          "max_qty": 5,
          "price": 65
        },
        {
          "min_qty": 6,
          "price": 60
        }
      ]
    },
    {
      "sku": "PK-030",
      "qty_unit": "kg",
      "tiers": [